date,fixture,pick,league,kickoff_uk,back_odds,lay_odds,back_stake,estimated_ql,actual_ql,two_up_triggered,trigger_minute,final_score,final_result,net_pl,status,lesson,notes,last_updated
2026-05-23,Bayern Munich vs VfB Stuttgart,Bayern Munich,DFB-Pokal Final,"Saturday 23 May 2026, 19:00 UK",1.40,1.42,10,0.14,0.14,No,,"No 2UP profit confirmed; final score not provided",No 2UP trigger,-0.14,Settled,"Excellent low-QL test but no 2UP profit; strong reminder that even good low-QL setups still need actual two-goal separation and offer settlement.","Settled from user-confirmed no 2UP profit across the old pick slate. Exact final score and exchange/book settlement not provided, so estimated QL is recorded as actual QL until corrected.",2026-05-23
2026-05-23,Auckland FC vs Sydney FC,Auckland FC,A-League Men Grand Final,"Saturday 23 May 2026, 09:10 UK",2.10,2.30,10,0.87,0.87,No,,"Auckland FC 1-0 Sydney FC",Auckland win,-0.87,Settled,"No 2UP trigger despite the win; good reminder that a solid volatility shape still needs actual two-goal separation, not just the favourite winning.","Settled from user-confirmed 1-0 result. No 2UP trigger; recorded estimated QL as actual QL until exact book/exchange settlement says otherwise.",2026-05-23
2026-05-23,Celtic vs Dunfermline Athletic,Celtic,Scottish Cup Final,"Saturday 23 May 2026, 15:00 UK",1.20,1.23,10,0.24,0.24,No,,"No 2UP profit confirmed; final score not provided",No 2UP trigger,-0.24,Settled,"Tiny QL but no 2UP profit; useful lesson that ultra-short favourites are only worthwhile when the two-goal trigger actually arrives.","Settled from user-confirmed no 2UP profit across the old pick slate. Exact final score and exchange/book settlement not provided, so estimated QL is recorded as actual QL until corrected.",2026-05-23
2026-05-24,West Ham United vs Leeds United,Leeds United,Premier League,"Sunday 24 May 2026, 16:00 UK",4.50,4.70,20,1.15,1.15,No,,"Lost / no 2UP profit confirmed",No 2UP trigger,-1.15,Settled,"Leeds position lost/no 2UP profit. The £5 free bet unlock still has estimated future value, but the cash result for this qualifying bet is recorded as the 2% QL.","Updated from Rory's instruction on 2026-05-25: all pending Sunday positions lost. Actual QL set to headline 2% estimate until exact settlement is provided. Leeds: £20 back at 4.50, lay at 4.70, 2% commission, headline/actual QL £1.15. £5 free bet unlocked remains recorded separately as estimated future value, not cash P/L.",2026-05-25
2026-05-24,Sunderland vs Chelsea,Chelsea,Premier League,"Sunday 24 May 2026, 16:00 UK",2.00,2.12,20,1.33,1.33,No,,"Lost / no 2UP profit confirmed",No 2UP trigger,-1.33,Settled,"Chelsea position lost/no 2UP profit. Wider spread than City and no early-payout recovery; record the 2% QL as actual loss unless exact settlement later differs.","Updated from Rory's instruction on 2026-05-25: all pending Sunday positions lost. Actual QL set to headline 2% estimate until exact settlement is provided. Chelsea: £20 back at 2.00, lay at 2.12, 2% commission, headline/actual QL £1.33.",2026-05-25
2026-05-24,Manchester City vs Aston Villa,Manchester City,Premier League,"Sunday 24 May 2026, 16:00 UK",1.30,1.34,30,1.05,1.05,No,,"Lost / no 2UP profit confirmed",No 2UP trigger,-1.05,Settled,"Manchester City position lost/no 2UP profit. Low QL protected the downside, but no useful 2UP payout was realised.","Updated from Rory's instruction on 2026-05-25: all pending Sunday positions lost. Actual QL set to headline 2% estimate until exact settlement is provided. Man City: £30 back at 1.30, lay at 1.34, 2% commission, headline/actual QL £1.05.",2026-05-25
2026-05-24,Sporting Kansas City vs New York Red Bulls,double-sided: Kansas City + NY Red Bulls,MLS,"Sunday 24 May 2026, live/started","Kansas 3.00 / NYRB 2.10","Kansas 3.15 / NYRB 2.26",20,2.50,2.50,Yes,,"Sporting Kansas City 1-2 New York Red Bulls",NYRB 2UP triggered but NYRB won,-2.50,Settled,"Good selection and live read: NYRB triggered 2UP and the match reached 2-1 comeback pressure, but the trigger team still won, so there was no 2UP profit. This is a high-quality near miss, not a dead pick.","Settled from user-confirmed final score and QL. Rory only got on the NYRB side/position live, but this row records the intended double-sided MLS test. Actual QL/net P&L recorded as -£2.50 from Rory's settlement.",2026-05-24
