date,fixture,pick,league,kickoff_uk,back_odds,lay_odds,back_stake,estimated_ql,actual_ql,two_up_triggered,trigger_minute,final_score,final_result,net_pl,status,lesson,notes,last_updated
2026-05-23,Bayern Munich vs VfB Stuttgart,Bayern Munich,DFB-Pokal Final,"Saturday 23 May 2026, 19:00 UK",1.40,1.42,10,0.14,0.14,No,,"No 2UP profit confirmed; final score not provided",No 2UP trigger,-0.14,Settled,"Excellent low-QL test but no 2UP profit; strong reminder that even good low-QL setups still need actual two-goal separation and offer settlement.","Settled from user-confirmed no 2UP profit across the old pick slate. Exact final score and exchange/book settlement not provided, so estimated QL is recorded as actual QL until corrected.",2026-05-23
2026-05-23,Auckland FC vs Sydney FC,Auckland FC,A-League Men Grand Final,"Saturday 23 May 2026, 09:10 UK",2.10,2.30,10,0.87,0.87,No,,"Auckland FC 1-0 Sydney FC",Auckland win,-0.87,Settled,"No 2UP trigger despite the win; good reminder that a solid volatility shape still needs actual two-goal separation, not just the favourite winning.","Settled from user-confirmed 1-0 result. No 2UP trigger; recorded estimated QL as actual QL until exact book/exchange settlement says otherwise.",2026-05-23
2026-05-23,Celtic vs Dunfermline Athletic,Celtic,Scottish Cup Final,"Saturday 23 May 2026, 15:00 UK",1.20,1.23,10,0.24,0.24,No,,"No 2UP profit confirmed; final score not provided",No 2UP trigger,-0.24,Settled,"Tiny QL but no 2UP profit; useful lesson that ultra-short favourites are only worthwhile when the two-goal trigger actually arrives.","Settled from user-confirmed no 2UP profit across the old pick slate. Exact final score and exchange/book settlement not provided, so estimated QL is recorded as actual QL until corrected.",2026-05-23
2026-05-24,West Ham United vs Leeds United,Leeds United,Premier League,"Sunday 24 May 2026, 16:00 UK",4.50,4.70,20,0.85,,Pending,,Pending,Pending,,Live,"Live Leeds 2UP/reload position: £20 back at 4.50 and lay at 4.70. The position also unlocked a £5 free bet, so it has reload value before any 2UP upside.","Rory manually confirmed the Leeds position on 2026-05-24: £20 back stake at 4.50, lay at 4.70. Approx lay stake £19.15 and lay liability £70.85 before commission. Estimated QL: £0.85 before commission, about £1.15 at 2%, about £1.61 at 5%. £5 free bet unlocked; at 75% assumed retention this is about £3.75 value, giving approximate net reload value after QL of £2.90 before commission, £2.60 at 2%, or £2.14 at 5%. West Ham side remains optional only if odds improve enough. Recheck exact settlement, commission, offer terms and 2UP status before treating value as final.",2026-05-24
2026-05-24,Sporting Kansas City vs New York Red Bulls,double-sided: Kansas City + NY Red Bulls,MLS,"Sunday 24 May 2026, live/started","Kansas 3.00 / NYRB 2.10","Kansas 3.15 / NYRB 2.26",20,2.50,2.50,Yes,,"Sporting Kansas City 1-2 New York Red Bulls",NYRB 2UP triggered but NYRB won,-2.50,Settled,"Good selection and live read: NYRB triggered 2UP and the match reached 2-1 comeback pressure, but the trigger team still won, so there was no 2UP profit. This is a high-quality near miss, not a dead pick.","Settled from user-confirmed final score and QL. Rory only got on the NYRB side/position live, but this row records the intended double-sided MLS test. Actual QL/net P&L recorded as -£2.50 from Rory's settlement.",2026-05-24
