date,fixture,pick,league,kickoff_uk,back_odds,lay_odds,back_stake,estimated_ql,actual_ql,two_up_triggered,trigger_minute,final_score,final_result,net_pl,status,lesson,notes,last_updated
2026-05-23,Bayern Munich vs VfB Stuttgart,Bayern Munich,DFB-Pokal Final,"Saturday 23 May 2026, 19:00 UK",1.40,1.42,10,0.14,0.14,No,,"No 2UP profit confirmed; final score not provided",No 2UP trigger,-0.14,Settled,"Excellent low-QL test but no 2UP profit; strong reminder that even good low-QL setups still need actual two-goal separation and offer settlement.","Settled from user-confirmed no 2UP profit across the old pick slate. Exact final score and exchange/book settlement not provided, so estimated QL is recorded as actual QL until corrected.",2026-05-23
2026-05-23,Auckland FC vs Sydney FC,Auckland FC,A-League Men Grand Final,"Saturday 23 May 2026, 09:10 UK",2.10,2.30,10,0.87,0.87,No,,"Auckland FC 1-0 Sydney FC",Auckland win,-0.87,Settled,"No 2UP trigger despite the win; good reminder that a solid volatility shape still needs actual two-goal separation, not just the favourite winning.","Settled from user-confirmed 1-0 result. No 2UP trigger; recorded estimated QL as actual QL until exact book/exchange settlement says otherwise.",2026-05-23
2026-05-23,Celtic vs Dunfermline Athletic,Celtic,Scottish Cup Final,"Saturday 23 May 2026, 15:00 UK",1.20,1.23,10,0.24,0.24,No,,"No 2UP profit confirmed; final score not provided",No 2UP trigger,-0.24,Settled,"Tiny QL but no 2UP profit; useful lesson that ultra-short favourites are only worthwhile when the two-goal trigger actually arrives.","Settled from user-confirmed no 2UP profit across the old pick slate. Exact final score and exchange/book settlement not provided, so estimated QL is recorded as actual QL until corrected.",2026-05-23
2026-05-24,West Ham United vs Leeds United,Leeds United,Premier League,"Sunday 24 May 2026, 16:00 UK",4.50,4.70,20,1.15,,Pending,,Pending,Pending,,Live,"Live Leeds 2UP/reload position: £20 back at 4.50 and lay at 4.70. The position also unlocked a £5 free bet, so it has reload value before any 2UP upside.","Rory manually confirmed the Leeds position on 2026-05-24: £20 back stake at 4.50, lay at 4.70, with 2% commission as default. Approx lay stake £19.23 and lay liability £71.15 at 2%. Headline estimated QL: £1.15 at 2% commission. £5 free bet unlocked; at 75% assumed retention this is about £3.75 value, giving approximate net reload value after 2% QL of £2.60. Recheck exact settlement, offer terms and 2UP trigger status before treating value as final.",2026-05-24
2026-05-24,Sunderland vs Chelsea,Chelsea,Premier League,"Sunday 24 May 2026, 16:00 UK",2.00,2.12,20,1.33,,Pending,,Pending,Pending,,Live,"Live Chelsea 2UP position: £20 back at 2.00 and lay at 2.12. Wider spread than City but better volatility/comeback profile.","Rory confirmed 2UP and liquidity and placed Chelsea on 2026-05-24: £20 back at 2.00, lay at 2.12, with 2% commission as default. Approx lay stake £19.05 and lay liability £21.33 at 2%. Headline estimated QL: £1.33 at 2% commission. Watch for Chelsea going two goals ahead and then failing to win.",2026-05-24
2026-05-24,Manchester City vs Aston Villa,Manchester City,Premier League,"Sunday 24 May 2026, 16:00 UK",1.30,1.34,30,1.05,,Pending,,Pending,Pending,,Live,"Live Manchester City 2UP position: £30 back at 1.30 and lay at 1.34. Very low QL and strong trigger profile, but routine-favourite risk if City go 2UP and still win comfortably.","Rory confirmed 2UP and liquidity and placed Manchester City on 2026-05-24: £30 back at 1.30, lay at 1.34, with 2% commission as default. Approx lay stake £29.55 and lay liability £10.05 at 2%. Headline estimated QL: £1.05 at 2% commission. Watch for City going two goals ahead and then failing to win; routine win remains the main risk.",2026-05-24
2026-05-24,Sporting Kansas City vs New York Red Bulls,double-sided: Kansas City + NY Red Bulls,MLS,"Sunday 24 May 2026, live/started","Kansas 3.00 / NYRB 2.10","Kansas 3.15 / NYRB 2.26",20,2.50,2.50,Yes,,"Sporting Kansas City 1-2 New York Red Bulls",NYRB 2UP triggered but NYRB won,-2.50,Settled,"Good selection and live read: NYRB triggered 2UP and the match reached 2-1 comeback pressure, but the trigger team still won, so there was no 2UP profit. This is a high-quality near miss, not a dead pick.","Settled from user-confirmed final score and QL. Rory only got on the NYRB side/position live, but this row records the intended double-sided MLS test. Actual QL/net P&L recorded as -£2.50 from Rory's settlement.",2026-05-24
